<?xml version="1.0" encoding="utf-8"?>
<!--
a product has ~ 140 bytes
-->
<products xsi:noNamespaceSchemaLocation="products.xsd" xmlns:xsi="http://www.w3.org/2001/XMLSchema-instance">
  <product id="1">
    <name>Simple Pen</name>
    <count>100000</count>
    <weight>12</weight>
    <prize>99</prize>
    <category_id>1</category_id>
  </product>
  <product id="2">
    <name>Big Pen</name>
    <count>400</count>
    <weight>20</weight>
    <prize>199</prize>
    <category_id>1</category_id>
  </product>
  <product id="3">
    <name>Big Pen</name>
    <count>400</count>
    <weight>20</weight>
    <prize>199</prize>
    <category_id>1</category_id>
  </product>
</products>